{
  "type": "typography",
  "id": "type_pair_playfair_sourcesans",
  "name": "Playfair Display + Source Sans 3",
  "version": 1,
  "display": {
    "family": "Playfair Display",
    "weight": 800,
    "licence": "OFL-1.1",
    "file": "PlayfairDisplay[wght].ttf",
    "file_url": "https://raw.githubusercontent.com/google/fonts/main/ofl/playfairdisplay/PlayfairDisplay%5Bwght%5D.ttf",
    "licence_url": "https://raw.githubusercontent.com/google/fonts/main/ofl/playfairdisplay/OFL.txt",
    "specimen_url": "https://fonts.google.com/specimen/Playfair+Display",
    "category": "serif",
    "case": "as-written",
    "avg_char_em": 0.45,
    "variable_axes": {
      "wght": [
        400.0,
        900.0
      ]
    }
  },
  "text": {
    "family": "Source Sans 3",
    "weight": 700,
    "licence": "OFL-1.1",
    "file": "SourceSans3[wght].ttf",
    "file_url": "https://raw.githubusercontent.com/google/fonts/main/ofl/sourcesans3/SourceSans3%5Bwght%5D.ttf",
    "licence_url": "https://raw.githubusercontent.com/google/fonts/main/ofl/sourcesans3/OFL.txt",
    "specimen_url": "https://fonts.google.com/specimen/Source+Sans+3",
    "category": "sans-serif",
    "case": "as-written",
    "avg_char_em": 0.434,
    "variable_axes": {
      "wght": [
        200.0,
        900.0
      ]
    }
  },
  "sizes": {
    "title_px": 84,
    "caption_px": 56,
    "min_caption_px": 46,
    "label_px": 48,
    "number_px": 110
  },
  "chars_per_line": {
    "title": 23,
    "caption": 36
  },
  "target": {
    "id": "generic_9x16",
    "label": "Vertical 9:16 (generic)",
    "platform": "generic",
    "aspect": "9:16",
    "width": 1080,
    "height": 1920,
    "safe_margins": {
      "top": 0.08,
      "bottom": 0.2,
      "left": 0.06,
      "right": 0.06
    },
    "margins_basis": "House margins (not a platform specification). Chosen to keep text clear of typical top bars, right-hand action buttons and bottom description areas. Not verified against platform documentation on 2026-10-10; preview on the platform before publishing."
  },
  "mood": [
    "history",
    "documentary",
    "relationships",
    "calm"
  ],
  "why": "High-contrast serif headlines with a plain humanist sans for captions; good for biographies and quotes."
}
